{
  "schema_version": 1,
  "name": "release",
  "description": "Gates a release on constraints, proof, review, and handoff.",
  "match": {
    "keywords": ["release", "deploy", "ship", "production", "launch"],
    "priority": 80
  },
  "stages": [
    { "skill": "constrain", "required": true, "purpose": "Establish the written quality bar with thresholds." },
    { "skill": "prove", "required": true, "purpose": "Write the proof that the release meets the constraints." },
    { "skill": "review", "required": true, "purpose": "Adversarial review against the stated constraints." },
    { "skill": "handoff", "required": true, "purpose": "Leave a takeover-ready record of the release state." }
  ],
  "rules": [
    "Do not begin a stage until the previous stage's artifact is complete and its evidence block is filled.",
    "A constraint without a threshold and a failure action is not a constraint.",
    "If review finds an unresolved high-severity finding, do not proceed to handoff."
  ],
  "on_optional_missing": "skip",
  "completion": "Done when the review artifact is empty of unresolved high-severity findings and the handoff artifact records the release state."
}
